id,Title,Content,Date,Permalink,Categories,"Image URL","Author Username"
123,"M1 Limited to deploy cloud billing platform offered by Aria Systems","<ul>
 	<li><strong>Cloud billing services will be provided by Aria on both fixed line and mobile networks to M1’s customers</strong></li>
 	<li><strong>Aria to primarily focus on supporting the efforts of M1 to enhance its consumer market base</strong></li>
</ul>
Prominent American software company – Aria Systems has reportedly announced that Singapore based telecom giant M1 Limited is adopting Aria’s billing and monetization platform with an aim to boost the company’s cloud-first digital transformation approach.

Reportedly, Aria Systems will offer cloud billing services on fixed-line and mobile platforms to M1’s consumers, wholesale and business customers as the provider is shifting to strengthen plan offerings in order to provide simple network solutions and improve the overall customer experience.

For the record, M1 Limited is a subsidiary of Keppel Corporation which is one of the most dynamic communication companies headquartered in Singapore. The firm offers mobile and fixed communication network services to more than two million customers across the globe.

M1 is set on a digital transformation drive to improve the overall customer experience and introduce digitization to its business, the firm required a cloud-enabled billing network that would facilitate quick response to the constantly changing trends in consumer mobile market and accordingly launch services.

Apparently, the cloud-based billing and monetization program is capable of providing high-end services along with supporting the management of advanced billing systems and offering billing at scale and user ratings.

According to Nathan Bell, Chief Digital Officer at M1 Limited, the cloud billing platform solution developed with the help of Aria’s experience will provide greater levels of flexibility and scalability to personalize the billing systems, giving M1 a chance to improve their digital network and provide a reliable and advanced experience to the customers.

The cloud-based monetization network by Aria Systems is top-ranked by many prominent research firms. Leading companies like Audi, Allstate, Adobe, Telstra and Comcast rely on Aria to accelerate time to market and enhance flexibility, allowing them to expand their customer value and maximize recurring revenue with the help of subscription-and usage led offerings.

<strong>Source Credits:</strong> <a href=""https://finance.yahoo.com/news/singapore-leading-communications-provider-m1-010000615.html"">https://finance.yahoo.com/news/singapore-leading-communications-provider-m1-010000615.html</a>",2020-02-12,https://www.theresearchprocess.com/2020/02/12/m1-limited-to-deploy-cloud-billing-platform-offered-by-aria-systems/,"Business News",https://www.theresearchprocess.com/wp-content/uploads/2020/02/m1-limited-to-deploy-cloud-billing-platform-offered-by-aria-systems.jpg,OmkarPatwardhan
132,"Tesla seeks regulatory approval to make long-range Model 3s in China","Tesla, the renowned US-based automotive and clean energy company, is reportedly seeking approval from the Chinese government to launch a new Model 3 variant made in China, according to a government document.

Credible sources cite, this new Model 3 variant would have a greater driving range. Like the existing Model 3 that is made in China, which boasts of a standard range of over 400 kilometers, the new variant would also be a rear-wheel-drive vehicle.

The new China-made Model 3 Long Range RWD is another version of Model 3 which was previously discontinued in the United States. The company has already manufactured more than 2,000 cars this year.

Tesla offered the Model 3 vehicle along with a Long Range battery pack and RWD (rear-wheel-drive) configuration when it first launched the Model 3 car.

However, this model was discontinued later as the company began to offer the Long Range battery together with a dual-motor AWD (all-wheel-drive) drivetrain.

Tesla, which began delivering its cars from December 2019 from the its $2 billion Tesla Shanghai factory, also sells imported Model 3s with a longer-range and an all-wheel drive across China.

The EV maker began manufacturing from its Shanghai factory on Monday following the end of an extended government holiday which was put in place owing to the coronavirus outbreak in the country.

The shares of the company surged by 9% after the reopening of the Shanghai factory.

Speaking of the factory closure due to coronavirus outbreak, Xu Wei, Shanghai municipal government spokesman stated that considering the practical problems major vehicle manufacturing companies have faced during the resuming of their production activities, the government would take efforts to help automakers restart their manufacturing activities as soon as possible.

It was expected that the Tesla Shanghai factory closure would delay some Model 3 deliveries. However, this shutdown is not expected to make a significant impact on the automobile manufacturer’s Q1 financial results, given that the new Shanghai factory has yet to establish itself as a major revenue contributor.

&nbsp;

Source credit: <a href=""https://finance.yahoo.com/news/tesla-seeks-approval-build-longer-041034629.html"">https://finance.yahoo.com/news/tesla-seeks-approval-build-longer-041034629.html</a>",2020-02-13,https://www.theresearchprocess.com/2020/02/13/tesla-seeks-regulatory-approval-to-make-long-range-model-3s-in-china/,"Automobile News",https://www.theresearchprocess.com/wp-content/uploads/2020/02/tesla-seeks-regulatory-approval-to-make-long-range-model-3s-in-china.jpg,OmkarPatwardhan
135,"Hyundai ties up with Canoo for future EV platform development","<ul>
 	<li><strong>Automobile giant has announced partnership with US based electric vehicle startup Canoo to develop an EV platform for its upcoming car models.</strong></li>
 	<li><strong>This partnership is expected to increase auto giant’s investment in next gen vehicle technologies.</strong></li>
 	<li><strong>Hyundai to invest more than USD 87 billion for enhancing its presence in future mobility market.</strong></li>
</ul>
Mergers, acquisitions, and collaborations across one of the biggest industries like automotive, is no more a big thing for the companies. However, partnership of Hyundai with US EV startup Canoo, is certainly a massive news which has kept the world looking for more.

The South Korean auto maker, Hyundai Motor Group, reportedly announced collaboration with Canoo in an effort to build an electric vehicle platform for its upcoming car models. Apparently, the auto giant is anticipating the new platform, a scalable skateboard architecture, to ease and simplify the development process, eventually lowering down the prices of vehicles produced by its two flagship units.

It has been claimed that Canoo’s skateboard architecture houses batteries and electric drivetrain, which offers relatively more interior cabin space and cost effective EV offering.

As per reliable reports, this deal is estimated to be Hyundai’s latest in a series of moves which is aimed to increase investment in the next generation automobile technologies via various partnerships with distinguished overseas startups.

Speaking on the collaboration, Research and Development head at Hyundai Motor Group, Albert Biermann, reportedly cited that the company is looking forward for developing a cost effective Hyundai platform concept which is autonomous and extremely suitable for mass adoption. He further added that the authorities are convinced with the speed and efficiency in which Canoo has been developing their innovative EV architecture, making them a perfect fit as a company partner for future automobile.

Meanwhile, Ulrich Kranz, head of Canoo quoted that the joint venture with a global leader, Hyundai is an honor for the company, and it looks forward to exploring EV architecture concept possibilities along with Hyundai for their upcoming models.

Moreover, Hyundai, in January this year enunciated its plan of investing approximately more than USD 87 billion in the next five years to augment its presence in future mobility markets.

Source credit: <a href=""http://koreabizwire.com/hyundai-joins-hands-with-startup-canoo-on-electric-vehicles/153313?ckattempt=2"">http://koreabizwire.com/hyundai-joins-hands-with-startup-canoo-on-electric-vehicles/153313?ckattempt=2</a>",1970-01-01,https://www.theresearchprocess.com/?p=135,"General News",,SaloniWalimbe
136,"Hyundai ties up with Canoo for future EV platform development","<ul>
 	<li><strong>Automobile giant has announced partnership with US based electric vehicle startup Canoo to develop an EV platform for its upcoming car models.</strong></li>
 	<li><strong>This partnership is expected to increase auto giant’s investment in next gen vehicle technologies.</strong></li>
 	<li><strong>Hyundai to invest more than USD 87 billion for enhancing its presence in future mobility market.</strong></li>
</ul>
Mergers, acquisitions, and collaborations across one of the biggest industries like automotive, is no more a big thing for the companies. However, partnership of Hyundai with US EV startup Canoo, is certainly a massive news which has kept the world looking for more.

The South Korean auto maker, Hyundai Motor Group, reportedly announced collaboration with Canoo in an effort to build an electric vehicle platform for its upcoming car models. Apparently, the auto giant is anticipating the new platform, a scalable skateboard architecture, to ease and simplify the development process, eventually lowering down the prices of vehicles produced by its two flagship units.

It has been claimed that Canoo’s skateboard architecture houses batteries and electric drivetrain, which offers relatively more interior cabin space and cost effective EV offering.

As per reliable reports, this deal is estimated to be Hyundai’s latest in a series of moves which is aimed to increase investment in the next generation automobile technologies via various partnerships with distinguished overseas startups.

Speaking on the collaboration, Research and Development head at Hyundai Motor Group, Albert Biermann, reportedly cited that the company is looking forward for developing a cost effective Hyundai platform concept which is autonomous and extremely suitable for mass adoption. He further added that the authorities are convinced with the speed and efficiency in which Canoo has been developing their innovative EV architecture, making them a perfect fit as a company partner for future automobile.

Meanwhile, Ulrich Kranz, head of Canoo quoted that the joint venture with a global leader, Hyundai is an honor for the company, and it looks forward to exploring EV architecture concept possibilities along with Hyundai for their upcoming models.

Moreover, Hyundai, in January this year enunciated its plan of investing approximately more than USD 87 billion in the next five years to augment its presence in future mobility markets.

Source credit: <a href=""http://koreabizwire.com/hyundai-joins-hands-with-startup-canoo-on-electric-vehicles/153313?ckattempt=2"">http://koreabizwire.com/hyundai-joins-hands-with-startup-canoo-on-electric-vehicles/153313?ckattempt=2</a>",2020-02-13,https://www.theresearchprocess.com/2020/02/13/hyundai-ties-up-with-canoo-for-future-ev-platform-development/,"General News",https://www.theresearchprocess.com/wp-content/uploads/2020/02/doe-hyundai-unite-for-transportation-technology-support-assessment.jpg,SaloniWalimbe
